EventCode,EventBaseCode,EventRootCode,SOURCEURL,DATEADDED,entry,ARTICLETEXT
116,116,11,https://www.stabroeknews.com/2024/04/28/news/guyana/linden-taxi-driver-gets-12-years-for-rape-of-girl-11/,20240428,73,"Thirty-two-year-old Linden taxi driver, Evon Barker called ‘Baby,’ has been sentenced to 12 years in jail for raping an 11-year-old girl in 2022.

The sentence was imposed on Thursday by High Court Judge Sandil Kissoon.

At his arraignment in February, the man denied the charge levelled against him.

Two weeks later on the day his trial was set to commence, he changed his plea, admitting that he did rape the young girl.

He owned-up to the prosecution’s case against him of preying on the 11-year-old whom he had dropped to an event.

Prosecutors say that later on the day in question, Barker returned for the child and drove her to a bushy area where he raped her in the back seat of his car.

When given a chance to address the court on Thursday, the offender said “I’m sorry for whatever act I committed. Sorry for whatever hurt that I’ve committed. I’m not a bad person. I pray to God. I am just hoping that this family could forgive me.”

Meanwhile, in his mitigating address to the court, the offender’s attorney, Ronald Bostwick, asked the Judge to consider his client’s early guilty plea; stating that there was no evidence of grooming.

In his sentencing remarks, Justice Kissoon said that he had considered the seriousness and prevalence of the offence of rape against children, the age-difference, and the impact the incident has had on the survivor and her family.

Justice Kissoon pointed out that Barker’s explanation to the court of being unaware “that the girl was so young;” was “unacceptable” and “inexcusable.”

The Judge said that persons providing such public services are held to a higher standard because of the trust their passengers would repose in them.

The state’s case was presented by prosecutors Nafeeza Baig and Latifah Elliot."
55,55,5,http://www.koreaherald.com/view.php?ud=20240428050122,20240428,74,"Medical schools that have been allocated additional seats anticipate opening a minimum of 1,500 new slots for the upcoming year, as they are set to make final decisions on their admissions availability following the government’s decision to grant flexibility in the quota allocation.

The government earlier said it would allow medical schools to freely adjust new seats within a 50 to 100 percent range of the enrollment quota given to them for the 2025 academic year. It announced in February that it would increase the quota by 2,000.

The limit has been capped at 3,058 per year since 2006, when it was lowered from 3,507 to assuage doctors protesting the policy of separating the prescribing and dispensing of drugs at that time.

While the admissions quota for the 32 medical schools that received the increase is slowly taking shape, the shrinking of quotas among national universities is likely to happen, according to reports Sunday, citing educational authorities.

Kyungpook National University, which has 110 seats in its current quota, has decided to accept 45 additional medical students for next year, half of the initially proposed increase. Gyeongsang National University and Jeju National University will recruit 62 and 30 new students, respectively, coming to half the planned expansion.

Chungbuk National University, which got the largest increase of 151 new admissions spots, will reportedly settle on its quota this week, along with Kangwon National University and Chungnam National University.

Private schools such as Yonsei University in Gangwon Province and Daegu Catholic University received seven and 40 new slots, respectively. Along with other private colleges such as Inje University, Kosin University, Dong-A University, Chosun University, Keimyung University and Yeungnam University, these private medical schools will likely fill all of their increased admissions quotas.

In line with the adjustment, the medical school enrollment quota would increase by 1,500 or 1,700 seats, from the currently proposed 2,000, according to observers.

Each university must submit its finalized enrollment quota to the Korean Council for University Education by the end of this month.

Meanwhile, five medical schools will likely start their first day of school next month, with students showing little signs of willingness to return and as medical professors are resigning.

Konyang University, Chosun University and Inha University -- which were initially to start classes Monday -- have postponed the start of their new semesters, according to reports. The three schools have yet to specify the date for the new academic calendar. Soonchunhyang University has not determined when classes will start, while Chung-Ang University starts school Wednesday.

While the finalized quota still hangs in the balance, Lim Hyun-taek, the new president of the Korean Medical Association, on Sunday repeated the demand for the total scrapping of the expansion plan, warning he would not respond to any talks with the government otherwise.

“This is not a conflict between the medical circle and the government, but (the government’s) unilateral abuse of power. If the government realizes the gravity of the situation, it should apologize to the public and the medical community as soon as possible,” Lim said at the KMA’s general meeting."
26,26,2,http://www.koreaherald.com/view.php?ud=20240428050122,20240428,75,"Medical schools that have been allocated additional seats anticipate opening a minimum of 1,500 new slots for the upcoming year, as they are set to make final decisions on their admissions availability following the government’s decision to grant flexibility in the quota allocation.

The government earlier said it would allow medical schools to freely adjust new seats within a 50 to 100 percent range of the enrollment quota given to them for the 2025 academic year. It announced in February that it would increase the quota by 2,000.

The limit has been capped at 3,058 per year since 2006, when it was lowered from 3,507 to assuage doctors protesting the policy of separating the prescribing and dispensing of drugs at that time.

While the admissions quota for the 32 medical schools that received the increase is slowly taking shape, the shrinking of quotas among national universities is likely to happen, according to reports Sunday, citing educational authorities.

Kyungpook National University, which has 110 seats in its current quota, has decided to accept 45 additional medical students for next year, half of the initially proposed increase. Gyeongsang National University and Jeju National University will recruit 62 and 30 new students, respectively, coming to half the planned expansion.

Chungbuk National University, which got the largest increase of 151 new admissions spots, will reportedly settle on its quota this week, along with Kangwon National University and Chungnam National University.

Private schools such as Yonsei University in Gangwon Province and Daegu Catholic University received seven and 40 new slots, respectively. Along with other private colleges such as Inje University, Kosin University, Dong-A University, Chosun University, Keimyung University and Yeungnam University, these private medical schools will likely fill all of their increased admissions quotas.

In line with the adjustment, the medical school enrollment quota would increase by 1,500 or 1,700 seats, from the currently proposed 2,000, according to observers.

Each university must submit its finalized enrollment quota to the Korean Council for University Education by the end of this month.

Meanwhile, five medical schools will likely start their first day of school next month, with students showing little signs of willingness to return and as medical professors are resigning.

Konyang University, Chosun University and Inha University -- which were initially to start classes Monday -- have postponed the start of their new semesters, according to reports. The three schools have yet to specify the date for the new academic calendar. Soonchunhyang University has not determined when classes will start, while Chung-Ang University starts school Wednesday.

While the finalized quota still hangs in the balance, Lim Hyun-taek, the new president of the Korean Medical Association, on Sunday repeated the demand for the total scrapping of the expansion plan, warning he would not respond to any talks with the government otherwise.

“This is not a conflict between the medical circle and the government, but (the government’s) unilateral abuse of power. If the government realizes the gravity of the situation, it should apologize to the public and the medical community as soon as possible,” Lim said at the KMA’s general meeting."
101,101,10,https://www.stabroeknews.com/2024/04/28/news/guyana/file-returned-to-dpp-in-matter-of-jagnandan-shooting-death-police/,20240428,76,"The file concerning the shooting incident which claimed the life of 18-year-old Jared Jagnandan on March 21 has been returned to the Director of Public Prosecutions (DPP), according to information related by police to the Sunday Stabroek yesterday.

On April 2, this newspaper had reported that the parents of Jagnandan were demanding answers from the police over the circumstances of the death of their son.

The guard who was a suspect in the matter, was arrested at Vigilance Police Station and the shotgun lodged along with five live cartridges and one spent shell. He is no longer in police custody

The police in a statement had said that they were investigating the shooting which occurred at about 11.10 am on March 21 at Shaf Auto Sales located at Lot 157 Lusignan, East Coast Demerara. The incident involved a 20-year-old security officer attached to Cerberus Security Service, who was armed with a 12-gauge shotgun, which is owned by the security company and was used in the shooting death of Jagnandan.

Avalon Jagnandan, in an interview with Stabroek News had stated that the post-mortem examination showed that his son died from multiple gunshot wounds.

The distraught father had told this newspaper that according to doctors, his 18-year-old son would have been alive today if only his employer, Shafeer Khan, had taken the teen to the nearest medical facility instead of relying on Cerberus Security Service."
353,35,3,https://www.devdiscourse.com/article/politics/2920140-bjp-confident-of-double-digit-seat-tally-in-telangana-assembly-polls-k-laxman,20240428,77,"The BJP will win more than 10 of the total 17 Lok Sabha seats in Telangana on the back of Prime Minister Narendra Modi's popularity and his development agenda and corruption-free governance, BJP Rajya Sabha member K Laxman said.

It is going to be a landslide victory for the BJP in Telangana in the Lok Sabha elections, Laxman, a member of BJP's parliamentary board, said.

The BJP won four seats in Telangana in the 2019 general elections.

''People from every nook and corner of the state are looking towards PM Modi, his development agenda and welfare schemes for the poor and his achievements during the last 10 years,'' he told PTI here.

In the Assembly polls held last year, people might have voted for the local issues, but they are definitely going to vote for Modi as their choice for PM in the Parliament elections, he said.

The Congress had won the Assembly elections, defeating the BRS which was in power since 2014 when Telangana was formed.

Asked what are the factors that will contribute to BJP's success in the present Lok Sabha elections, Laxman said Modi's charisma, his development agenda and zero-tolerance towards corruption are among the causes that will determine voters' choice in favour of BJP.

In Telangana, people are looking for development and that is possible only with the BJP under the leadership of Modi, he said.

''We will definitely cross double digits (in LS polls). Our seats will be more than all parties put together,'' said Laxman, a former president of BJP in Telangana.

Asked about Telangana Chief Minister A Revanth Reddy's remarks that the BJP would change the Constitution and abolish reservations, Laxman said the CM is speaking out of frustration.

Modi has repeatedly said he would not allow anybody to change the Constitution, Laxman, national president of BJP's OBC Morcha, pointed out.

''It is you (Congress) people who are working against the Constitution. You are giving communal reservations which is anti-Constitution,'' he said.

Architect of the Constitution Babasaheb Ambedkar never wanted religion-based reservations, but Congress is proposing religion-based reservations which is opposed by BJP, he said.

''You (Congress) are also now clinching away the rights of OBCs, SCs, STs by appeasing Muslim community,'' he said.

On the allegation that the BJP is increasingly raking up communal issues during the ongoing Lok Sabha election campaign, Laxman said it is the opposition parties who are repeatedly talking about reservations for Muslims and others.

''Modi speaks for the poor irrespective of caste, whether it is Hindu, Muslim or Christian. Modi says we are working for the poor, women, youth and farmers,'' he said.

The BJP, which won four seats in Telangana in the 2019 general elections, is hoping to win a majority of the constituencies now to add to its national kitty.

Polling for all the 17 Lok Sabha seats in Telangana will be held on May 13.

(This story has not been edited by Devdiscourse staff and is auto-generated from a syndicated feed.)"
124,124,12,https://www.devdiscourse.com/article/politics/2920140-bjp-confident-of-double-digit-seat-tally-in-telangana-assembly-polls-k-laxman,20240428,78,"The BJP will win more than 10 of the total 17 Lok Sabha seats in Telangana on the back of Prime Minister Narendra Modi's popularity and his development agenda and corruption-free governance, BJP Rajya Sabha member K Laxman said.

It is going to be a landslide victory for the BJP in Telangana in the Lok Sabha elections, Laxman, a member of BJP's parliamentary board, said.

The BJP won four seats in Telangana in the 2019 general elections.

''People from every nook and corner of the state are looking towards PM Modi, his development agenda and welfare schemes for the poor and his achievements during the last 10 years,'' he told PTI here.

In the Assembly polls held last year, people might have voted for the local issues, but they are definitely going to vote for Modi as their choice for PM in the Parliament elections, he said.

The Congress had won the Assembly elections, defeating the BRS which was in power since 2014 when Telangana was formed.

Asked what are the factors that will contribute to BJP's success in the present Lok Sabha elections, Laxman said Modi's charisma, his development agenda and zero-tolerance towards corruption are among the causes that will determine voters' choice in favour of BJP.

In Telangana, people are looking for development and that is possible only with the BJP under the leadership of Modi, he said.

''We will definitely cross double digits (in LS polls). Our seats will be more than all parties put together,'' said Laxman, a former president of BJP in Telangana.

Asked about Telangana Chief Minister A Revanth Reddy's remarks that the BJP would change the Constitution and abolish reservations, Laxman said the CM is speaking out of frustration.

Modi has repeatedly said he would not allow anybody to change the Constitution, Laxman, national president of BJP's OBC Morcha, pointed out.

''It is you (Congress) people who are working against the Constitution. You are giving communal reservations which is anti-Constitution,'' he said.

Architect of the Constitution Babasaheb Ambedkar never wanted religion-based reservations, but Congress is proposing religion-based reservations which is opposed by BJP, he said.

''You (Congress) are also now clinching away the rights of OBCs, SCs, STs by appeasing Muslim community,'' he said.

On the allegation that the BJP is increasingly raking up communal issues during the ongoing Lok Sabha election campaign, Laxman said it is the opposition parties who are repeatedly talking about reservations for Muslims and others.

''Modi speaks for the poor irrespective of caste, whether it is Hindu, Muslim or Christian. Modi says we are working for the poor, women, youth and farmers,'' he said.

The BJP, which won four seats in Telangana in the 2019 general elections, is hoping to win a majority of the constituencies now to add to its national kitty.

Polling for all the 17 Lok Sabha seats in Telangana will be held on May 13.

(This story has not been edited by Devdiscourse staff and is auto-generated from a syndicated feed.)"
1041,104,10,https://www.newsx.com/national/congress-alleges-false-voting-in-west-tripura-ls-seat-demands-fresh-elections/,20240428,80,"Congress MLA and member of the Congress Working Committee, Sudip Roy Barman, has reiterated his demand for fresh elections in the West Tripura parliamentary constituency and Ramnagar assembly constituency, citing widespread “false voting” and the disenfranchisement of genuine voters during the electoral process.

Barman has provided a list of 579 polling booths where he alleges that the elections were marred by fraudulent practices. He further accuses certain Assistant Returning Officers (AROs) in South, Gomati, and Sepahijala districts of pressuring micro observers to alter their reports regarding instances of massive false voting.

In a letter addressed to the Chief Electoral Officer of Tripura, Barman expressed disbelief at the CEO’s explanation of Election Duty Certificate (EDC) voting, which purportedly led to voter turnout exceeding 100 per cent in some polling stations. He cited examples of discrepancies in voter turnout compared to the number of registered voters in several booths.

Additionally, Barman highlighted instances of polling booths recording more than 100 per cent turnout and cited examples of voters being obstructed or prevented from casting their ballots without adequate intervention from law enforcement or election officials.

Accusing the election conducting body of biased treatment towards the opposition party, Barman demanded a complete re-poll in the West Tripura parliamentary constituency and the Ramnagar assembly constituency.

The letter serves as a formal plea for action to address the alleged irregularities and ensure the integrity of the electoral process in Tripura."
214,21,2,https://www.miragenews.com/kalamunda-indecent-assault-1223618/,20240428,81,"Midland Detectives are seeking information regarding an incident in Kalamunda on Wednesday 24 April 2024, in which a woman was indecently assaulted.

About 5:20pm, the woman was walking along Canning Road when she was approached an unknown male juvenile riding a scooter. As the male rode past her he indecently assaulted her.

Detectives are seeking any CCTV or dash-cam from the Canning Road and surrounding area that captured any person riding a scooter around the time of the incident.

CCTV, dash-cam or mobile phone vision can be uploaded directly to investigators via this link: https://wapf.au.evidence.com/axon/community-request/public/kalamundaindecentassault

Anyone with information regarding this incident is asked to call Crime Stoppers on 1800 333 000 or report the information online at www.crimestopperswa.com.au."
52,52,5,https://www.worcesternews.co.uk/news/24276189.pinvin-c-e-first-school-celebrates-latest-ofsted-report/,20240428,82,"The headteacher of Pinvin C of E First school said he is ""immensely proud"" after Ofsted rated the school as good in its latest inspection.

The school was previously found to be inadequate after an inspection in February last year.

James Hawthorn, Headteacher at Pinvin C of E First School, said: ""We are immensely proud of the whole school community - The children, our families and our wonderful staff.

""Ofsted have recognised that everyone has worked so hard to ensure we are delivering the very best for our children so that everyone can be happy, grow and flourish.""

Ofsted inspectors acknowledged that the school has had several changes in staff in the past few years including the introduction of an additional deputy headteacher and praised the school for swiftly addressing safeguarding concerns following their previous inspection.

The Ofsted report said: ""The school has recently reviewed and developed the curriculum.

""It is broad, ambitious and designed to give pupils what they need.

""However, some staff are unclear about the best ways to deliver the planned curriculum.""

The report did criticise the level of pupil attended at the school but acknowledged that it had improved and that staff at the school were aware of the issue.

The Ofsted report continued: ""Leaders place a high priority on making sure that pupils are in school.

""Their work in this area is having a positive impact.

""Pupils overall attendance has improved, nonetheless, too many pupils are persistently absent.""

Staff were also praised for their student support and taking the time to get to know pupils well stating ""pupils with special educational needs and/or disabilities receive good support and are included fully in all aspects of school life.""

The Ofsted report's final critique said: ""Some pupils' work lacks pride and contains basic grammar, punctuation and spelling errors.

""Teachers do not consistently address this.

""As a result, these pupils repeat the same mistakes or are not being helped to present work to a high standard."""
