EventCode,EventBaseCode,EventRootCode,SOURCEURL,DATEADDED,entry,ARTICLETEXT
192,192,19,http://europe.chinadaily.com.cn/a/202404/27/WS662c84a8a31082fc043c45d6.html,20240428,22,"The Shushan Gunan Street historical and cultural block has become a gathering place for a new generation of zisha craftsmen.[Photo provided to China Daily]

Nestled at the foot of Shushan Mountain, beside the tranquil Lihe River, Gunan Street in Yixing, Jiangsu province, whispers tales of a bygone era. Once the vibrant heart of zisha, or reddish-brown pottery production, this historical street pulsated with the creativity of artisans and the commerce of traders.

Today, after undergoing extensive renovation, it has become a gathering place for a new generation of craftsmen dedicated to preserving the unique artistry of zisha pottery.

In April 2010, the Jiangsu provincial government officially recognized this area as the Shushan Gunan Street historical and cultural block. The district's layout, with the river encircling the mountain and the street running parallel, has preserved the essence of zisha pottery production, trade, and transportation since the Ming and Qing dynasties (1368-1911).

Chu Chengliang, vice-president of the Yixing folk cultural relics and artifacts association, explains that the preservation and restoration of this neighborhood were spearheaded by the government. They set the precedent by selecting five key areas, inspiring residents to prioritize preservation and undertake necessary upgrades to their own homes.

""The local government regularly gathers feedback and advice from local residents about how to maintain and improve the district,"" Chu adds. ""Then they review these suggestions at the end of the year to see what they've accomplished. This has really got people involved in sprucing up our neighborhood.""

Today, Gunan Street is not just a place to study the history and culture of zisha pottery, it has become a lively community where artisans and experts in the craft thrive. Many old houses along the street are now leased by craftsmen for pottery making and habitation, attracting lots of young talent.

""The government kept the street's original vibe intact, even restoring some historical features,"" Chu explains. He mentions that by hosting events like weekend markets, they have brought in young people. The revamped shops on Gunan Street are not just pottery stores, however; there are also dining options, making the street more diverse. Many local residents have also moved back, turning their homes into small craft workshops, art shops, and tea houses.

Led by Wang Jianguo, a professor at Southeast University's School of Architecture, the team has designed many public spaces in the area, in collaboration with the local government, enhancing local life. They have also helped plan the restoration of several houses and provided design services to the community.

""We've taken a gradual approach to renovation,"" explains Shen Yang, another Southeast University architecture professor and a member of Wang's team.

""We've even designed model rooms to help residents with their own renovation, showing precise dimensions for doors, windows, pillars and beams.

""While the area may not have many large traditional courtyards, it's a lively neighborhood. The transformation of the district is an ongoing process without a definite endpoint,"" he says."
874,87,8,https://gazette.com/news/education/special-education-program-struggles-in-academy-d-20-school-detailed-district-responds/article_d7aa28f4-00ce-11ef-b1b2-4f737774f4fe.html,20240428,23,"A state complaint has prompted Academy District 20 to address the special education program at one of its schools following instructional losses and staff turnover over the past two school years.

The complaint alleged that D-20 denied a student their right to a Free Appropriate Public Education (FAPE) by failing to implement their individualized education program (IEP) while they attended an unnamed elementary school in the district.

Dwindling staff, abuse by a teacher and an unsafe environment making instruction nearly impossible were detailed in an investigation conducted by the Colorado Department of Education in response to the complaint.

The district must now enact a number of changes to address each violation identified at the school over the next year.

The investigation, which includes interviews with parents, staff and teachers, along with district documentation, ultimately found that D-20 had violated state and federal law by failing to implement or revise multiple students’ individualized education programs (IEP).

“In sum, despite a high level of support provided by the District, this time period from the beginning of the 2023-2024 school year to October 10 posed, by all credible accounts, a great challenge to adequately addressing the SSN program Students’ needs,” state complaint officer Nicholaus Podsiadlik wrote in the state's decision.

The significant support needs (SSN) program refers to the program in place at a school for students with a number of greater needs including cognition, communication, movement, and social and emotional abilities. Students in these programs may also have health, sensory, physical, or behavioral disabilities.

An IEP is a document unique to every student who attends a public school and receives special education in compliance with the federal Individuals with Disabilities Education Act (IDEA) and state Exceptional Children’s Education Act (ECEA).

The primary reason for failing to meet these needs was reportedly due to a lack of needed staff.

2022-23

The parents of a student at the school alleged it failed to implement the student's IEP during the 2022-23 and 2023-24 school years.

The loss of learning is traced back to Nov. 1, 2022, when the complainant’s student’s full-time SSN teacher went on anticipated leave through Feb. 20. This led to instructional inconsistencies for the 10 students in the program that year.

Challenges included a long-term substitute teacher resigning, hiring multiple short-term substitutes without special education endorsements and a fluctuating number of paraprofessionals.

“When necessary, other staff at School would also help supervise the SSN program,” Podsiadlik said.

The teacher prepared learning arrangements for each student and their IEP, but this ultimately proved to be unsuccessful due to a lack of consistency. Upon her return, she noted the students showed some regression but were able to recover by the end of the school year.

Parents, however, reported behavioral loses over this period that were never recovered.

2023-24

The teacher informed the district they would not return to the program for the 2023-24 year. This vacancy wasn’t filled by the start of the year and the program now had five paraprofessionals and 13 students with “significant medical, behavioral, and academic needs.”

Featured Local Savings

The school’s principal emailed D-20’s Executive Director for Special Education on Aug. 11 to express concern that support was insufficient going into the year.

“We need immediate assistance in SSN. Our paras are not in a good spot and may quit if attention is not given,” he wrote. “The tutor that was sent had no idea how to support SSN and no one else has been here … We don’t have any support in setting up our schedules and more students are being added to our caseload.”

Eleven short-term substitutes were hired over this time before a new full-time SSN teacher was eventually hired in October, leading to further inconsistency and aggressive behavior by students.

One student’s gastronomy tube was pulled out multiple times, while others hit staff and attempted to elope. On Sept. 26, one student, who required “adult supervision and support throughout the school day to ensure safety,” was found inside a closed dryer in a locked bathroom.

Two paraprofessionals resigned during this time and, following the dryer incident, the principal would also leave the school.

D-20 officials would then become involved in the SSN program and provide supplemental staff with varying credentials along with greater expert support to relieve staff and continue program operation.

“Even the service providers — the physical therapist, occupational therapist, and speech-language pathologist — pitched in during their visits to supervise the children and give the paraprofessionals a break,” Podsiadlik said.

“There were, at times, no teacher in the room, as few as one or two paraprofessionals, and ‘daily schedule and routine changes due to a revolving door of substitute and district staff supporting in the classroom.’”

When the new teacher was hired in October, struggles continued, both in educating students and supervising their behavior. Instructional time was largely spent responding to unsafe behaviors, tending to students' hygiene and helping students eat, drink, and use the bathroom.

The new teacher would also resort to physical intervention and verbal outbursts toward students out of frustration. Parents’ around this time consistently expressed concerns over the students' safety and regressing academic and functional performance.

They began transferring their children from the program and, by the time the new teacher resigned on Feb. 12, only seven students were enrolled in the program.

A new licensed teacher was then hired by the district March 11, but the state of the program by that point still made meeting each child’s IEP needs a challenge.

“The SCO finds that … the opportunity for instruction was minimal, no expert was able to provide individualized adjustments to match the children’s performance, and the environment diminished Students’ ability to learn,” Podsiadlik said.

Going Forward

The state concluded that D-20 didn’t implement the specialized instruction and curriculum modifications required by the students’ IEPs, monitor or report their progress, resulting in a denial of FAPE.

To resolve these violations, the CDE ordered the district to submit a corrective action plan that addresses each violation noted in the complaint along with 64 hours of compensatory education for students during the summer to meet each student’s IEP goals, in addition to speech-language therapy, occupational therapy and behavioral education as compensatory services. All hours are to be completed ahead of the 2024-25 school year, but parents may opt out of some or all of this education. The services must be completed within the year without exception.

D-20’s communication department provided a statement to the Gazette confirming its work on resolving all the findings through a corrective action plan.

“Although we will not expressly comment on individual claims associated with this complaint, D20 is committed to working with all of our families to ensure the success of each and every student,” the statement read.

The district went on to say they have met with each family to ensure their needs are met, began offering compensatory services and added efforts and leadership in the school and program mentioned in the complaint."
831,83,8,https://www.stltoday.com/news/local/education/webster-university-chancellor-s-pay-surpassed-1-million-in-2022/article_546cf474-fc34-11ee-8c4c-73596e37fee0.html,20240428,24,"WEBSTER GROVES — Chancellor Beth Stroble’s reported compensation grew to more than $1 million in 2022, including a bonus of more than $120,000, as financial problems worsened at Webster University.

In an email last week to the university’s faculty and staff, Board Chair Sumit Verma noted that Stroble and President Julian Schuster’s pay for the 2022 calendar year, the most recent publicly available, included performance bonuses from the previous year, and future years were unlikely to include such bonuses.

“It is important for you to also know the chancellor, president and board agreed that — given the financial situation of the university — performance awards in subsequent years were reduced and/or eliminated entirely, regardless of how other goals may have been performed,” Verma said.

Moreover, Stroble voluntarily gave up about $104,000 of her deferred compensation that year when she decided to retire.

The details were revealed last week when the university’s most recent tax documents were made public. Tax reporting for nonprofits like Webster University is typically delayed as part of the Internal Revenue Service filing process. The documents reflect the school's 2022-2023 fiscal year, but pay only for calendar year 2022.

The university declined to release pay for the 2023 calendar year.

Sign up for the Brick City newsletter Steph Kukuljan and other business reporters bring you insights into St. Louis-area real estate and development.

The tax filings highlight the continuing challenges facing the university, which saw administrator pay balloon over the past decade, even as enrollment fell by 50% and the institution lost $167 million in revenue.

University leaders, though, point to the university’s recent gains in enrollment and say Webster is on the rebound.

“Great days are ahead for Webster University,” Verma said in the email to faculty and staff.

Enrollment improved this past school year, but finances remained a problem. The university plans to use more than $30 million in endowment funds, typically earmarked for research, professorships and scholarships, to meet a loan obligation and improve its financial stature.

Meanwhile, morale at the Webster Groves-based institution worsened. Faculty, staff and students grew more frustrated with the board and leaders’ lack of transparency surrounding administrators’ compensation after a series of reports from the Post-Dispatch. It prompted a public callout, vote of no confidence and a protest.

The mounting pressure and media attention led Stroble, who had served at Webster for 15 years, to announce her resignation in December. She is taking a sabbatical, and her retirement is slated to take effect on June 30. A search for her replacement is underway.

Stroble will forfeit $629,000 by choosing to retire, financial documents show. Neither the board nor the university have confirmed if she will receive a salary when she returns in the fall as “chancellor emeritus.” She’s expected to focus on alumni relations and fundraising in that role.

The tax filings show that nearly all of the university’s highest-paid administrators received more money in 2022. But total compensation for Schuster, the president, fell 9% from the previous year to $778,133. Chief Financial Officer Rick Meyer, who recently retired, also saw an 18% decline to $160,962.

Stroble’s pay increased 2% from the previous year, when she received $992,000.

The documents showed that contributions to the university in 2022-23 decreased by 78% — a result of COVID-19 pandemic funds ending.

They also revealed that her daughter, Emily Stroble, earned $48,084 as a university employee in 2022. Emily Stroble’s LinkedIn page shows she is employed as a student access coordinator. She was first hired in December 2021 as a department assistant for financial aid.

Webster did not disclose her status in tax filings during her first year of employment. Spokesman Patrick Giblin said Emily Stroble’s gross compensation for that year was below the IRS threshold — $10,000 — for reporting a family member of a key employee.

He declined to disclose how much she made that year, saying that information is confidential.

Beth Stroble’s husband, Paul Stroble, earned $15,000 for his work as a part-time adjunct professor at the university, where he has taught for 14 years. Webster has long reported his association with the university.

And the filings also reveal that the $1.9 million that was “misappropriated” and first disclosed in a recent audit was stolen I.T. equipment.

The university reported in its filings that it has added a surveillance camera and has started a database to track its equipment.

Editor's note: The most current Webster University tax form reflected 2022 calendar-year pay. This story has also been updated to reflect Stroble's loss of deferred compensation that year."
16,16,1,https://www.newsx.com/national/interim-bail-denied-for-hemant-soren-in-land-scam-case/,20240428,25,"Former Jharkhand Chief Minister Hemant Soren’s plea for interim bail to attend his uncle’s funeral has been denied by the Special PMLA Court in Ranchi in connection with a land scam case.

Soren, who had sought a 13-day interim bail from the court, faced refusal despite his request to pay his last respects to his uncle. This development comes amidst ongoing legal proceedings regarding his arrest and remand in the said case.

Additionally, Soren has moved the Supreme Court seeking relief, challenging his arrest and emphasizing the urgency of the matter, especially in light of the ongoing Lok Sabha elections. Senior Advocate Kapil Sibal, representing Soren, informed the Supreme Court bench about the pending decision on Soren’s petition challenging his arrest before the Jharkhand High Court, urging for an expedited hearing.

In February, the Jharkhand High Court reserved its judgment on Soren’s plea, wherein he contested the legality and arbitrary nature of his arrest and subsequent remand. Soren, through his advocate Pragya Baghel, asserted that his arrest was unwarranted and mired in malice, while also seeking interim bail during the legal proceedings.

ALSO READ : Mumbai Airport Faces Hoax Bomb Threat, Case Registered

The arrest of Hemant Soren, a prominent political figure and Chairperson of the Jharkhand Mukti Morcha (JMM), had sparked widespread speculation and garnered significant media attention. The Directorate of Enforcement (ED) had apprehended Soren in January in connection with a land scam investigation, involving the alleged forging of official records to acquire valuable land parcels through fraudulent means.

The probe focuses on the purported manipulation of land transactions, leading to the generation of substantial illegal proceeds. Soren’s arrest and subsequent legal battles have added to the political intrigue in Jharkhand, with the case poised to have far-reaching implications in the region’s political landscape.

As the legal proceedings unfold, the fate of Hemant Soren remains uncertain, with his plea for interim bail adding a new dimension to the ongoing saga surrounding the land scam case. The case underscores the complexities of governance and law enforcement in Jharkhand, raising pertinent questions about accountability and transparency in public office."
1383,138,13,https://lancasteronline.com/news/local/police-investigate-saturday-morning-bomb-threat-in-mountville-borough/article_7fe98bde-04dc-11ef-86e5-e3ac7065300f.html,20240428,26,"West Hempfield Township police said they’re investigating a bomb threat delivered via email to several recipients in Mountville Borough on Saturday morning.

Police responded to multiple locations near the 100 block of East Main Street just after 5 a.m. for reports of a bomb threat. The Pennsylvania State Police, Lancaster County Sheriff’s Office, Lancaster city police department and local fire departments also responded to the scene.

The 100 block of East Main Street was closed for about two hours as crews searched the area. Nothing suspicious was found, police said.

A state police officer deferred further questions to West Hempfield Township police. A call and an email left for the chief of West Hempfield Township police wasn’t returned by Saturday afternoon.

Anyone with information about the incident is asked to contact the West Hempfield Township police at 717-285-5191."
35,35,3,https://www.wdtv.com/2024/04/28/buzz-henderson-center-hosts-paddle-battle-tournament/,20240428,27,"MEADOWBROOK, W.Va (WDTV) - The newly opened Buzz Henderson Center in Meadowbrook hosted a pickleball tournament on Saturday.

This was the first event of its kind to be held at the center, which opened back in January.

The event consisted of three tournaments, one for each division based on the skill ratings of beginner, intermediate, and advanced.

Individuals from as far as Pittsburgh made the trip to participate in the event.

The entry fee for the tournament was $25.00 a person and $50.00 per team.

Michelle Frase, Program Director of the Buzz Henderson Center, says the tournament was a great way to bring people in the community together.

“When we first opened the building, we weren’t sure what would be the biggest draw,” said Frase.

“People who didn’t know each other but were maybe just neighbors in the community have come here, they’ve been able to play pickleball and build actual friendships and relationships.”

Proceeds from the event will benefit the Buzz Learning Academy, an outreach program from the center’s parent organization, Jewel City Church, that plans to launch in conjunction with the 2024-2025 school year.

A total of 27 teams competed in the tournament, reinforcing how popular the sport is becoming in our area.

Copyright 2024 WDTV. All rights reserved."
831,83,8,https://www.tribuneindia.com/news/himachal/ask-congress-nominee-why-govt-shut-11-institutions-ex-cm-to-rampur-voters-615377,20240428,28,"Our Correspondent

Rampur, April 27

Leader of the Opposition Jai Ram Thakur and BJP candidate from Mandi Lok Sabha seat Kangana Ranaut held an election rally in the Jhakri area of Rampur subdivision in Shimla district today.

Thakur sought votes from people saying the BJP was needed for the development of the country and the state. He added that the Congress candidate from Mandi Vikramaditya Singh is speaking with great enthusiasm these days. When a person speaks excessively in excitement, he loses his senses.

He urged people, “When Vikramaditya Singh comes to your area, you must ask him why did his government close 11 institutions that the previous BJP government had opened for the development and welfare of the area. Why Vikramaditya did not raise his voice then?

Kangana said that if Congress ministers had morality, considering the recent political crisis in the state, they would have resigned. She added, “If anyone has thought about respect and representation of women, it is Narendra Modi. That is why Modiji has brought 33 per cent reservation for women.”

She said that in the 2029 Assembly elections, 22 out of 68 MLAs in the state would be women. “Even today everyone knows that Narendra Modi will become Prime Minister again. In the absence of the double-engine government, the development of Himachal has stopped. The Congress government is crying hoarse about a financial crisis. If I am elected to the Lok Sabha, I will work for the development of Himachal,” she added.

Join Whatsapp Channel of The Tribune for latest updates.

#BJP #Congress #Jai Ram Thakur #Kangana Ranaut #Lok Sabha #Mandi #Shimla"
341,34,3,https://www.tribuneindia.com/news/himachal/ask-congress-nominee-why-govt-shut-11-institutions-ex-cm-to-rampur-voters-615377,20240428,29,"Our Correspondent

Rampur, April 27

Leader of the Opposition Jai Ram Thakur and BJP candidate from Mandi Lok Sabha seat Kangana Ranaut held an election rally in the Jhakri area of Rampur subdivision in Shimla district today.

Thakur sought votes from people saying the BJP was needed for the development of the country and the state. He added that the Congress candidate from Mandi Vikramaditya Singh is speaking with great enthusiasm these days. When a person speaks excessively in excitement, he loses his senses.

He urged people, “When Vikramaditya Singh comes to your area, you must ask him why did his government close 11 institutions that the previous BJP government had opened for the development and welfare of the area. Why Vikramaditya did not raise his voice then?

Kangana said that if Congress ministers had morality, considering the recent political crisis in the state, they would have resigned. She added, “If anyone has thought about respect and representation of women, it is Narendra Modi. That is why Modiji has brought 33 per cent reservation for women.”

She said that in the 2029 Assembly elections, 22 out of 68 MLAs in the state would be women. “Even today everyone knows that Narendra Modi will become Prime Minister again. In the absence of the double-engine government, the development of Himachal has stopped. The Congress government is crying hoarse about a financial crisis. If I am elected to the Lok Sabha, I will work for the development of Himachal,” she added.

Join Whatsapp Channel of The Tribune for latest updates.

#BJP #Congress #Jai Ram Thakur #Kangana Ranaut #Lok Sabha #Mandi #Shimla"
