EventCode,EventBaseCode,EventRootCode,SOURCEURL,DATEADDED,entry,ARTICLETEXT
1041,104,10,https://timesofindia.indiatimes.com/city/guwahati/karimganj-cong-nominee-demands-repoll-in-32-booths/articleshow/109657406.cms,20240428,40,"We also published the following articles recently

Repolling sought in six polling stations of Manipur

Fresh polling requested in six Inner Manipur Lok Sabha stations due to violence and machine destruction. Congress seeks repoll in 47 stations, claiming booth capture, including those in N Biren Singh's assembly segment.

Repolling at 11 violence-hit booths in Manipur today

Repolling ordered in 11 Inner Manipur stations due to violence. Pradeep Kumar Jha ordered repolling in specific stations. 70% polling recorded. Gunmen firing reported. Voters urged to participate actively in the process.

BJP holds Hanuman Chalisa recitations at polling booths in Delhi

Delhi BJP organized mass Hanuman Chalisa recitations at 9,000 locations. Virendra Sachdeva highlighted progress needs, criticized corruption. Om Prakash Dhankhar praised Hanumanji's devotion. Jai Prakash Agarwal prayed at Hanuman temples for residents' well-being.

Silchar : Congress candidate from Karimganj Lok Sabha constituency, Hafiz Rashid Ahmed Choudñury on Saturday demanded repoll in as many as 32 booths across the segment where polling was held on Friday, in the second phase of the general election.He alleged largescale rigging, booth capturing and intimidation of voters by “goons” in which local BJP and pro-BJP MLAs were involved in the misdeeds.Choudhury, who is also a renowned lawyer of the state, on Saturday submitted a petition to the returning officer (Karimganj) Mridul Yadav under relevant sections of the Representation of Peoples Act, 1950, for holding of fresh polls and countermanding of polls in the under noted polling stations on the grounds given in the petition.“On April 26, the day of voting, it was found that widespread rigging and booth was capturing in some of the polling stations (a total of 32) with defects, damage, and tampering that the actual result of the said poll stations cannot be ascertained,” the Congress candidate said.Choudhury in his petition said repolling in at least 32 polling stations is required by the exercise of powers under Sections 58 (2)(a) and 58A of the Representation of Peoples Act, 1950 under the circumstances “wherein rampant booth capturing has been committed the entire polling process”."
191,191,19,https://www.portageonline.com/articles/rm-of-portage-votes-to-re-zone-old-oakville-community-hall,20240428,41,"The Rural Municipality (RM) of Portage la Prairie's meeting this week included a vote to re-zone the lot that the old community hall sits on.

Eric DeLong, the President of the Oakville Community Club, says it's an important change for the town.

""Today, the RM voted to re-zone our old hall from Parks and Recreation to Residential. So, that's basically going to allow us, once we're in our new hall, to sell off our old hall property and convert it into residential neighbourhood.""

DeLong added that they community is working on a plan that would see them sell the land to establish more homes on the lot.

""We're hoping we can have a buyer come in and help develop housing in the area. It's a nice in-fill, it's already surrounded by houses, it's close to the school, it's close to the main street. So, we're hoping it will be a little bit of a boost to the town that way, and it just fits because we're going into the new hall, so there's no practical use to us for that place anymore.""

With so much attention on the new hall and daycare, the community has been buzzing with excitement for it to open. Last weekend's Trivia Night was a prime example."
833,83,8,https://www.outlookindia.com/elections/congress-wants-to-give-minorities-right-to-eat-beef-yogi-adityanath-attacks-opposition,20240428,42,"BJP leader and Union Minister Anurag Thakur echoed a similar claim during rally in UP's Hamirpur where he said, ""It is for the public to decide that your property should go to your children or the Muslims. We have given equal rights to the Muslims from toilets, to houses to gas cylinders to food but not in the name of religion."""
143,143,14,https://www.santafenewmexican.com/opinion/editorials/outside-the-shelter-gates-order-must-be-restored/article_b210d20c-03ec-11ef-bdf9-bb97784a5a4d.html,20240428,43,"State Alabama Alaska Arizona Arkansas California Colorado Connecticut Delaware Florida Georgia Hawaii Idaho Illinois Indiana Iowa Kansas Kentucky Louisiana Maine Maryland Massachusetts Michigan Minnesota Mississippi Missouri Montana Nebraska Nevada New Hampshire New Jersey New Mexico New York North Carolina North Dakota Ohio Oklahoma Oregon Pennsylvania Rhode Island South Carolina South Dakota Tennessee Texas Utah Vermont Virginia Washington Washington D.C. West Virginia Wisconsin Wyoming Puerto Rico US Virgin Islands Armed Forces Americas Armed Forces Pacific Armed Forces Europe Northern Mariana Islands Marshall Islands American Samoa Federated States of Micronesia Guam Palau Alberta, Canada British Columbia, Canada Manitoba, Canada New Brunswick, Canada Newfoundland, Canada Nova Scotia, Canada Northwest Territories, Canada Nunavut, Canada Ontario, Canada Prince Edward Island, Canada Quebec, Canada Saskatchewan, Canada Yukon Territory, Canada

Zip Code"
195,195,19,https://www.thehitavada.com/Encyc/2024/4/28/MI-17-V5-roped-in-to-douse-Uttarakhand-forest-fires.html,20240428,44,"MI-17 V5 roped in to douse Uttarakhand forest fires





DEHRADUN,

AN IAF helicopter was pressed into service on Saturday to extinguish the raging forest fires in Uttarakhand’s Nainital district, Chief Minister Pushkar Singh Dhami said. The situation in the district worsened on Friday with the flames reaching the High Court Colony in the Pines area. An MI-17 helicopter collected water in a Bambi Bucket from Bhimtal lake and poured it over the burning forests of Pines, Bhumiadhar, Jyolikot, Narayan Nagar, Bhawali, Ramgarh and Mukteshwar areas of the district, officials said. Chief Minister Pushkar Singh Dhami said all efforts are being made to bring the fires under control and it will be done soon. “An IAF helicopter has already started dousing the fires,” he said. Dhami said he will hold a meeting with forest officials in Haldwani later in the day to review the situation. Three people were arrested in Rudraprayag on Friday while trying to set fire to forests.

As many as 31 fresh incidents of forest fire were reported from various parts of the state on Friday, destroying 33.34 hectares of forest land, according to officials.The fire that broke out in the forest near Nainital took a horrific form on Friday, posing a threat to the residents of High Court Colony. It also affected traffic movement in the area. Besides forest department staff, Army personnel are involved in efforts to control the fire. Anil Joshi, a resident of the Pines area and assistant registrar of the Uttarakhand High Court said, “The fire had engulfed an old and vacant house located near The Pines on Friday. It did not cause any damage to High Court Colony but it came dangerously close to the buildings.” The administration has banned boating in Naini lake in view of the blaze."
195,195,19,https://www.thehitavada.com/Encyc/2024/4/28/MI-17-V5-roped-in-to-douse-Uttarakhand-forest-fires.html,20240428,45,"MI-17 V5 roped in to douse Uttarakhand forest fires





DEHRADUN,

AN IAF helicopter was pressed into service on Saturday to extinguish the raging forest fires in Uttarakhand’s Nainital district, Chief Minister Pushkar Singh Dhami said. The situation in the district worsened on Friday with the flames reaching the High Court Colony in the Pines area. An MI-17 helicopter collected water in a Bambi Bucket from Bhimtal lake and poured it over the burning forests of Pines, Bhumiadhar, Jyolikot, Narayan Nagar, Bhawali, Ramgarh and Mukteshwar areas of the district, officials said. Chief Minister Pushkar Singh Dhami said all efforts are being made to bring the fires under control and it will be done soon. “An IAF helicopter has already started dousing the fires,” he said. Dhami said he will hold a meeting with forest officials in Haldwani later in the day to review the situation. Three people were arrested in Rudraprayag on Friday while trying to set fire to forests.

As many as 31 fresh incidents of forest fire were reported from various parts of the state on Friday, destroying 33.34 hectares of forest land, according to officials.The fire that broke out in the forest near Nainital took a horrific form on Friday, posing a threat to the residents of High Court Colony. It also affected traffic movement in the area. Besides forest department staff, Army personnel are involved in efforts to control the fire. Anil Joshi, a resident of the Pines area and assistant registrar of the Uttarakhand High Court said, “The fire had engulfed an old and vacant house located near The Pines on Friday. It did not cause any damage to High Court Colony but it came dangerously close to the buildings.” The administration has banned boating in Naini lake in view of the blaze."
16,16,1,https://timesofindia.indiatimes.com/city/mangaluru/will-win-with-a-margin-of-1-2l-votes-says-padmaraj/articleshow/109658172.cms,20240428,46,"We also published the following articles recently

Voters yearning for change: Padmaraj

R Padmaraj Poojary, Congress candidate, criticizes BJPs divisive politics, aims for development in Mangaluru. Follows Sanatana Hindu Dharma, emphasizes communal harmony and investments, belonging to Billava community.

My commitment is towards Hindutva: Dakshina Kannada BJP candidate Brijesh Chowta

BJP appoints Brijesh Chowta to enhance development aligning with PM Modi's vision. His agenda includes infrastructure, tourism promotion, and addressing communal incidents in coastal Karnataka. Chowta aims to preserve Tulu language and culture while promoting harmony among diverse cultures.

'We need to set right narrative for Dakshina Kannada': Capt Brijesh Chowta

Capt Brijesh Chowta aims to correct the communally sensitive tag in Dakshina Kannada by promoting Hindutva, diverse cultures, public support, waterway connections, software industry growth, high-speed rail, heritage center, Tulu language recognition, countering Islamic fundamentalists, and prioritizing district development.

Mangaluru: Congress candidate from Dakshina Kannada Lok Sabha constituency , Padmaraj R Poojary, expressed confidence in winning the with a margin of 1.2 lakh votes.He informed reporters here on Saturday, that he is confident about winning the election due to the enthusiasm observed among the voters during the campaign. “I am confident of Congress winning the election, and thereby bring back the glory of communal harmony in the district,” he said.Padmaraj accused his opponents of attempting to secure victory in the election through spreading hate.He emphasised that elections should be viewed as a celebration of democracy rather than a platform for spreading animosity. “We need to win the hearts of voters through love and by sharing the contributions of the party. The Congress workers have displayed eagerness to drive change in the district. Our approach to voters involved showcasing the past contributions of the Congress and its MPs, instead of stirring up emotional matters. Elections should be contested based on sound arguments. He mentioned that in every unfortunate event during elections, the families of those involved in conflicts endure the consequences.Denying the allegations that the Congress fought the election in Dakshina Kannada on the basis of caste and religion, Padmaraj said, “I am also proud to call myself a Hindu, but I have not faced the election on this basis. However, the BJP was facing the election on the basis of Hindutva, Modi and religious sentiments.”To a query on BJP candidate Capt Brijesh Chowta seeking blessings of veteran Congress leader B Janardhana Poojary, Padmaraj said, “I have been working with Poojary for several years, but I have never used his name for selfish gains. I have been following his ideals and helping the needy. Elders blessing younger ones is a part of our culture.”Reiterating that his priority will be development and restoring communal harmony in the district, Padmaraj said, “There is a need to check on all the illegal activities in the district, and work towards the development of the region.”"
31,31,3,https://www.somersetcountygazette.co.uk/news/24282068.round-up-weeks-biggest-somerset-planning-applications/,20240428,47,"Every week, hundreds of planning applications are submitted to Somerset Council for determination – and we have selected some of the most interesting proposals.

Most plans will be decided by council planning officers, using their legally delegated powers, but some of the most significant or contentious will go before one of the council’s five planning committees.

Planning committees are made up of elected councillors, but the decisions they make should be decided based on the council’s planning policies, not local politics.

Somerset Timber Services Ltd., Allerford Road, Allerford

Somerset Timber Services is a family-run sawmill which operates just outside Norton Fitzwarren, on the north-western edge of Taunton.

The company is looking to diversify its operations by converting part of its existing base into four light industrial units.

The new units will still be access from the current site entrance on Allerford Road, with the option to convert the building back to its original state depending on the needs of the business.

Planning reference number: 27/24/0017

Sandys Hill Lane, Frome

Construction is currently proceeding on 198 homes within the Keyford Meadows site either side of Sandys Hill Lane on the southern edge of Frome.

As part of the outline permission for the development, which was secured in July 2020, new commercial units will be provided at the western edge of the site, near the existing Wessex Fields retail units.

TJ Morris Ltd. has now applied to build the first of these new units near the Sainsbury’s supermarket – with strong indications from the planning documents that it may end up being occupied by Home Bargains.

Planning reference number: 2024/0428/REM

A38 Bristol Road, Bridgwater

46 Bristol Road in Bridgwater, near the Bird in Hand public house, is already being operated as a house of multiple occupation (HMO) with four residents.

Mrs S. Nuttall is now applying to alter the property to allow twice as many people to live under the same roof.

The property lies on one of Bridgwater’s busiest roads, just north of the Cross Rifles roundabout – which will shortly be upgraded using money from the government’s levelling up fund.

Planning reference number: 08/24/00040

Manor Road, Cossington

Graham Wason has applied to build a new industrial unit and workshop on this agricultural land to the south of the grade two listed Cossington House and the surrounding Cossington Park.

A new access road will be created on Manor Road, with the new workshop being constructed to store maintenance tools and associated machinery.

A total of 29 car parking spaces will be created on site which can be used by leisure users at Cossington Park.

Planning reference number: 22/24/00002

Wyke Farms, Wyke Champflower

Wyke Farms has applied to build a combined heat and power engine (CHP) at its main cheese and butter making base in the small hamlet of Wyke Champflower, near Bruton.

The company already has one CHP which runs on gas produced from its own anaerobic digestion plan, which lies just over a mile up the road at Lambrook Farm.

This new CHP will be connected to the same supply, with the surplus energy being exported to several neighbouring villages.

Planning reference number: 24/00846/FUL

To comment on any of these applications (and others), visit www.somerset.gov.uk/planning-buildings-and-land/view-and-comment-on-a-planning-application"
871,87,8,https://www.foxcarolina.com/2024/04/28/clinton-police-search-owners-dogs-who-attacked-boy/,20240428,48,"CLINTON, S.C. (FOX Carolina) - Laurens County Crime Stoppers has issued a plea to the community asking for them to help identify the owners of a pack of dogs that attacked a young boy in February.

According to the Clinton Police Department, 11-year-old A’Rhyan Anderson was heading to a bus stop on North Livingston Street the morning of February 14 when a pack of dogs attacked him.

The attack sent Anderson to the hospital with serious injuries.

Police are asking for anyone who may have information that would help identify the owner(s) of those dogs to call Crime Stoppers at 864-68-CRIME or go to www.p3tips.com. Credible information could lead to an award.

Previous coverage: “Boy in stable condition following dog attack in Clinton, mom says”

Copyright 2024 WHNS. All rights reserved."
874,87,8,https://www.gaytimes.co.uk/culture/why-wouldnt-you-lorraine-kelly-showcases-her-support-for-the-trans-community/,20240428,49,"Lorraine Kelly has opened up about her love for the trans community in a new interview.

On 26 April, the TV legend made an appearance on Joe Lycett’s Channel 4 talk show, Late Night Lycett.

Of course, Lorraine’s time on the show was full of incredible moments, including her participation in the hilarious sketch “Straight Talking with Richard Yewtree” and revealing the controversial political guest who walked out of her show.

In addition to her comedic one-liners and adorable stories, the iconic presenter delivered an impactful and supportive message regarding the trans community.

When asked why she has dedicated time to being a trans ally, Lorraine said, “You know, why wouldn’t you?”

She added: “That’s what I don’t understand. I don’t see why I wouldn’t. It’s been so toxic and people just want to get on with their lives and everybody’s different I think we have to treat [people] as individuals.

“I’ve got trans friends who knew when they were three… then there are other people who maybe it was a bit more difficult for them. But at the end of the day I think we just need to have more kindness, more compassion and stop throwing rocks at one another.“

﻿

Lorraine’s recent appearance on Late Night Lycett isn’t the first time she has expressed support for the LGBTQIA+ community.

In a 2022 interview with GAY TIMES, she discussed the rise of anti-trans rhetoric around the world and the importance of standing up against hate.

“It really is hard, but do you know what? I think there’s so much more strength together,“ she said.

“I think it’s heartbreaking to see all the fractures that are happening and, like I say, a small minority making a lot of noise, but there’s strength in numbers, and there’s strength together, and I think that’s the most important thing and, you know, I would always say to anybody who’s going through anything, get help. Don’t be afraid to talk.”

The 64-year-old talent has also used her hit talk show Lorraine to support gay marriage.

In March, she hosted couple Luke Avaient and Gavin Sheppard’s wedding to celebrate the 10th anniversary of England and Wales legalising same-sex marriage.

“It’s a real privilege for me to be a witness to your wedding and to show people across the country that love is love,” she said while wearing a rainbow dress.

You can watch Lorraine’s full Late Night Lycett appearance on Channel 4’s website."
72,72,7,https://www.ky3.com/2024/04/28/springfield-police-department-expanding-its-help-fight-kia-hyundai-thefts/,20240428,50,"SPRINGFIELD, Mo. (KY3) - A viral social media trend called the “KIA challenge” is revealing an alarming loophole in the vehicle’s software, allowing anyone with a USB chord or screwdriver to steal the vehicle.

We’ve told you about this before and how the Springfield Police Department is looking to combat this growing trend by offering free safety devices for those vehicle owners in the Springfield area.

It may be called the “KIA challenge,” but this affects drivers of both Kia and Hyundais. SPD has been offering wheel locks to people in the Springfield area, but now they’re expanding that help to those living around Springfield too.

“Come to police headquarters between 7 a.m. and 5 p.m., and we want to give one to you to help keep your vehicle safe,” said Cris Swaters with the Springfield Police Department.

Across the country owners of Hyundais and Kias, have been the victim of what’s called the Kia Challenge. It shows users how to easily steal those vehicles with just a USB drive or a screwdriver.

“Previously, we had said Springfield area, but if you live in any of the surrounding communities, Nixa, Republic Ozark Willard Strafford, Marshfield pleasant hope any of those surrounding communities and you come into Springfield stopped by police HQ if you have a Kia or Hyundai, we want to help keep your vehicle safe too,” said Swaters.

It’s an issue that hits home for many, and it’s no different here at KY3. One of our producers, Zach Dodge, was on a trip for his birthday in St. Louis. He says around 3 a.m. one day, he and his wife noticed that someone had broken into their car.

“They smashed the back passenger side window,” said Dodge. “And whenever we went outside, there were no alarms or anything going off from our car. It wasn’t until he opened the drivers, the passenger side front door to get out that the alarms then started going off.”

Dodge says he wasn’t sure if these criminals were inspired by the trend on social media, until he noticed what the crooks left behind and looked deeper

“It was a screwdriver that was out from it,” he recalled. “So we’re we’re pretty sure he was trying to get access to underneath there where the ignition there’s like a spot where you can just jam something in a lot of the videos. It’s like a USB stick that they use. And it lets you be able to turn the ignition to start the car”

While Dodge hasn’t yet gotten his hands on one of the wheel locks, he says you should take the opportunity to make your car less of a target.

“Just follow those tips that I know Ashley Reynolds puts out all the time to keep your car clean. Keep the stuff out of your car, make it less enticing for someone to want to break into your vehicle,” said Dodge.

Now remember, this issue comes from the software in the vehicles, in light of that both Kia and Hyundai have websites to plug in your VIN to see if you’re eligible for a software upgrade. For KIA owners, click here. For Hyundai owners, click here.

To report a correction or typo, please email digitalnews@ky3.com

Copyright 2024 KY3. All rights reserved."
45,45,4,https://www.wesh.com/article/spacex-falcon-9-galileo-satellite-saturday/60626578,20240428,51,"SpaceX successfully launched a Falcon 9 rocket carrying a satellite for the European Commission's Galileo satellite navigation system.The Falcon 9 rocket supporting the Galileo L12 mission launched from Launch Complex 39A at Kennedy Space Center at 8:34 p.m. Saturday. The mission's satellite payload is being sent to medium Earth orbit.The Galileo L12 mission will add another satellite to the European Commission's Galileo Global Navigation Satellite System (GNSS). GNSS is a more precise satellite navigation and location system compared to GPS.This was the 20th and final launch for the Falcon 9 first stage rocket booster due to the satellite being delivered deeper into space. The first stage booster previously launched Turksat 5a, Transporter-2, Intelsat G-33/G-34, over a dozen Starlink missions and several others.

SpaceX successfully launched a Falcon 9 rocket carrying a satellite for the European Commission's Galileo satellite navigation system.

The Falcon 9 rocket supporting the Galileo L12 mission launched from Launch Complex 39A at Kennedy Space Center at 8:34 p.m. Saturday. The mission's satellite payload is being sent to medium Earth orbit.

Advertisement

The Galileo L12 mission will add another satellite to the European Commission's Galileo Global Navigation Satellite System (GNSS). GNSS is a more precise satellite navigation and location system compared to GPS.

This was the 20th and final launch for the Falcon 9 first stage rocket booster due to the satellite being delivered deeper into space. The first stage booster previously launched Turksat 5a, Transporter-2, Intelsat G-33/G-34, over a dozen Starlink missions and several others."
